{
  "title": "Casos de Covid-19 en México",
  "type": "docs",
  "positive": [
    {
        "pdf": "covid-19-resultado-positivos-indre-2020-03-13.png",
        "date": "13/03/2020"
    },
    {
        "pdf": "covid-19-resultado-positivos-indre-2020-03-14.pdf",
        "txt": "txt/covid-19-resultado-positivos-indre-2020-03-14.txt",
        "csv": "csv/covid-19-resultado-positivos-indre-2020-03-14.csv",
        "date": "14/03/2020"
    },
    {
        "pdf": "covid-19-resultado-positivos-indre-2020-03-15.pdf",
        "txt": "txt/covid-19-resultado-positivos-indre-2020-03-15.txt",
        "csv": "csv/covid-19-resultado-positivos-indre-2020-03-15.csv",
        "date": "15/03/2020"
    },
    {
        "pdf": "covid-19-resultado-positivos-indre-2020-03-16.pdf",
        "txt": "txt/covid-19-resultado-positivos-indre-2020-03-16.txt",
        "csv": "csv/covid-19-resultado-positivos-indre-2020-03-16.csv",
        "date": "16/03/2020"
    },
    {
        "pdf": "covid-19-resultado-positivos-indre-2020-03-17.pdf",
        "txt": "txt/covid-19-resultado-positivos-indre-2020-03-17.txt",
        "csv": "csv/covid-19-resultado-positivos-indre-2020-03-17.csv",
        "date": "17/03/2020"
    },
    {
        "pdf": "covid-19-resultado-positivos-indre-2020-03-18.pdf",
        "txt": "txt/covid-19-resultado-positivos-indre-2020-03-18.txt",
        "csv": "csv/covid-19-resultado-positivos-indre-2020-03-18.csv",
        "date": "18/03/2020"
    },
    {
        "pdf": "covid-19-resultado-positivos-indre-2020-03-19.pdf",
        "txt": "txt/covid-19-resultado-positivos-indre-2020-03-19.txt",
        "csv": "csv/covid-19-resultado-positivos-indre-2020-03-19.csv",
        "date": "19/03/2020"
    },
    {
        "pdf": "covid-19-resultado-positivos-indre-2020-03-20.pdf",
        "txt": "txt/covid-19-resultado-positivos-indre-2020-03-20.txt",
        "csv": "csv/covid-19-resultado-positivos-indre-2020-03-20.csv",
        "date": "20/03/2020"
    },
    {
        "pdf": "covid-19-resultado-positivos-indre-2020-03-21.pdf",
        "txt": "txt/covid-19-resultado-positivos-indre-2020-03-21.txt",
        "csv": "csv/covid-19-resultado-positivos-indre-2020-03-21.csv",
        "date": "21/03/2020"
    },
    {
        "pdf": "covid-19-resultado-positivos-indre-2020-03-22.pdf",
        "txt": "txt/covid-19-resultado-positivos-indre-2020-03-22.txt",
        "csv": "csv/covid-19-resultado-positivos-indre-2020-03-22.csv",
        "date": "22/03/2020"
    },
    {
        "pdf": "covid-19-resultado-positivos-indre-2020-03-23.pdf",
        "txt": "txt/covid-19-resultado-positivos-indre-2020-03-23.txt",
        "csv": "csv/covid-19-resultado-positivos-indre-2020-03-23.csv",
        "date": "23/03/2020"
    },
    {
        "pdf": "covid-19-resultado-positivos-indre-2020-03-24.pdf",
        "txt": "txt/covid-19-resultado-positivos-indre-2020-03-24.txt",
        "csv": "csv/covid-19-resultado-positivos-indre-2020-03-24.csv",
        "date": "24/03/2020"
    },
    {
        "pdf": "covid-19-resultado-positivos-indre-2020-03-25.pdf",
        "txt": "txt/covid-19-resultado-positivos-indre-2020-03-25.txt",
        "csv": "csv/covid-19-resultado-positivos-indre-2020-03-25.csv",
        "date": "25/03/2020"
    },
    {
        "pdf": "covid-19-resultado-positivos-indre-2020-03-26.pdf",
        "txt": "txt/covid-19-resultado-positivos-indre-2020-03-26.txt",
        "csv": "csv/covid-19-resultado-positivos-indre-2020-03-26.csv",
        "date": "26/03/2020"
    },
    {
        "pdf": "covid-19-resultado-positivos-indre-2020-03-27.pdf",
        "txt": "txt/covid-19-resultado-positivos-indre-2020-03-27.txt",
        "csv": "csv/covid-19-resultado-positivos-indre-2020-03-27.csv",
        "date": "27/03/2020"
    },
    {
        "pdf": "covid-19-resultado-positivos-indre-2020-03-28.pdf",
        "txt": "txt/covid-19-resultado-positivos-indre-2020-03-28.txt",
        "csv": "csv/covid-19-resultado-positivos-indre-2020-03-28.csv",
        "date": "28/03/2020"
    },
    {
        "pdf": "covid-19-resultado-positivos-indre-2020-03-29.pdf",
        "txt": "txt/covid-19-resultado-positivos-indre-2020-03-29.txt",
        "csv": "csv/covid-19-resultado-positivos-indre-2020-03-29.csv",
        "date": "29/03/2020"
    },
    {
        "pdf": "covid-19-resultado-positivos-indre-2020-03-30.pdf",
        "txt": "txt/covid-19-resultado-positivos-indre-2020-03-30.txt",
        "csv": "csv/covid-19-resultado-positivos-indre-2020-03-30.csv",
        "date": "30/03/2020"
    },
    {
        "pdf": "covid-19-resultado-positivos-indre-2020-03-31.pdf",
        "txt": "txt/covid-19-resultado-positivos-indre-2020-03-31.txt",
        "csv": "csv/covid-19-resultado-positivos-indre-2020-03-31.csv",
        "date": "31/03/2020"
    },
    {
        "pdf": "covid-19-resultado-positivos-indre-2020-04-01.pdf",
        "txt": "txt/covid-19-resultado-positivos-indre-2020-04-01.txt",
        "csv": "csv/covid-19-resultado-positivos-indre-2020-04-01.csv",
        "date": "01/04/2020"
    },
    {
        "pdf": "covid-19-resultado-positivos-indre-2020-04-02.pdf",
        "txt": "txt/covid-19-resultado-positivos-indre-2020-04-02.txt",
        "csv": "csv/covid-19-resultado-positivos-indre-2020-04-02.csv",
        "date": "02/04/2020"
    }
  ],
  "suspected": [
    {
        "pdf": "covid-19-resultado-sospechosos-indre-2020-02-25.pdf",
        "date": "25/02/2020",
        "csv": "csv/covid-19-resultado-sospechosos-indre-2020-02-25.csv",
        "txt": "txt/covid-19-resultado-sospechosos-indre-2020-02-25.txt"
    },
    {
        "pdf": "covid-19-resultado-sospechosos-indre-2020-03-08.pdf",
        "date": "08/03/2020",
        "csv": "csv/covid-19-resultado-sospechosos-indre-2020-03-08.csv",
        "txt": "txt/covid-19-resultado-sospechosos-indre-2020-03-08.txt"
    },
    {
        "pdf": "covid-19-resultado-sospechosos-indre-2020-03-13.pdf",
        "date": "13/03/2020",
        "csv": "csv/covid-19-resultado-sospechosos-indre-2020-03-13.csv",
        "txt": "txt/covid-19-resultado-sospechosos-indre-2020-03-13.txt"
    },
    {
        "pdf": "covid-19-resultado-sospechosos-indre-2020-03-14.pdf",
        "date": "14/03/2020",
        "csv": "csv/covid-19-resultado-sospechosos-indre-2020-03-14.csv",
        "txt": "txt/covid-19-resultado-sospechosos-indre-2020-03-14.txt"
    },
    {
        "pdf": "covid-19-resultado-sospechosos-indre-2020-03-15.pdf",
        "date": "15/03/2020",
        "csv": "csv/covid-19-resultado-sospechosos-indre-2020-03-15.csv",
        "txt": "txt/covid-19-resultado-sospechosos-indre-2020-03-15.txt"
    },
    {
        "pdf": "covid-19-resultado-sospechosos-indre-2020-03-16.pdf",
        "date": "16/03/2020",
        "csv": "csv/covid-19-resultado-sospechosos-indre-2020-03-16.csv",
        "txt": "txt/covid-19-resultado-sospechosos-indre-2020-03-16.txt"
    },
    {
        "pdf": "covid-19-resultado-sospechosos-indre-2020-03-17.pdf",
        "date": "17/03/2020",
        "csv": "csv/covid-19-resultado-sospechosos-indre-2020-03-17.csv",
        "txt": "txt/covid-19-resultado-sospechosos-indre-2020-03-17.txt"
    },
    {
        "pdf": "covid-19-resultado-sospechosos-indre-2020-03-18.pdf",
        "date": "18/03/2020",
        "csv": "csv/covid-19-resultado-sospechosos-indre-2020-03-18.csv",
        "txt": "txt/covid-19-resultado-sospechosos-indre-2020-03-18.txt"
    },
    {
        "pdf": "covid-19-resultado-sospechosos-indre-2020-03-19.pdf",
        "date": "19/03/2020",
        "csv": "csv/covid-19-resultado-sospechosos-indre-2020-03-19.csv",
        "txt": "txt/covid-19-resultado-sospechosos-indre-2020-03-19.txt"
    },
    {
        "pdf": "covid-19-resultado-sospechosos-indre-2020-03-20.pdf",
        "date": "20/03/2020",
        "csv": "csv/covid-19-resultado-sospechosos-indre-2020-03-20.csv",
        "txt": "txt/covid-19-resultado-sospechosos-indre-2020-03-20.txt"
    },
    {
        "pdf": "covid-19-resultado-sospechosos-indre-2020-03-21.pdf",
        "date": "21/03/2020",
        "csv": "csv/covid-19-resultado-sospechosos-indre-2020-03-21.csv",
        "txt": "txt/covid-19-resultado-sospechosos-indre-2020-03-21.txt"
    },
    {
        "pdf": "covid-19-resultado-sospechosos-indre-2020-03-22.pdf",
        "date": "22/03/2020",
        "csv": "csv/covid-19-resultado-sospechosos-indre-2020-03-22.csv",
        "txt": "txt/covid-19-resultado-sospechosos-indre-2020-03-22.txt"
    },
    {
        "pdf": "covid-19-resultado-sospechosos-indre-2020-03-23.pdf",
        "date": "23/03/2020",
        "csv": "csv/covid-19-resultado-sospechosos-indre-2020-03-23.csv",
        "txt": "txt/covid-19-resultado-sospechosos-indre-2020-03-23.txt"
    },
    {
        "pdf": "covid-19-resultado-sospechosos-indre-2020-03-24.pdf",
        "date": "24/03/2020",
        "csv": "csv/covid-19-resultado-sospechosos-indre-2020-03-24.csv",
        "txt": "txt/covid-19-resultado-sospechosos-indre-2020-03-24.txt"
    },
    {
        "pdf": "covid-19-resultado-sospechosos-indre-2020-03-25.pdf",
        "date": "25/03/2020",
        "csv": "csv/covid-19-resultado-sospechosos-indre-2020-03-25.csv",
        "txt": "txt/covid-19-resultado-sospechosos-indre-2020-03-25.txt"
    },
    {
        "pdf": "covid-19-resultado-sospechosos-indre-2020-03-26.pdf",
        "date": "26/03/2020",
        "csv": "csv/covid-19-resultado-sospechosos-indre-2020-03-26.csv",
        "txt": "txt/covid-19-resultado-sospechosos-indre-2020-03-26.txt"
    },
    {
        "pdf": "covid-19-resultado-sospechosos-indre-2020-03-27.pdf",
        "date": "27/03/2020",
        "csv": "csv/covid-19-resultado-sospechosos-indre-2020-03-27.csv",
        "txt": "txt/covid-19-resultado-sospechosos-indre-2020-03-27.txt"
    },
    {
        "pdf": "covid-19-resultado-sospechosos-indre-2020-03-28.pdf",
        "date": "28/03/2020",
        "csv": "csv/covid-19-resultado-sospechosos-indre-2020-03-28.csv",
        "txt": "txt/covid-19-resultado-sospechosos-indre-2020-03-28.txt"
    },
    {
        "pdf": "covid-19-resultado-sospechosos-indre-2020-03-29.pdf",
        "date": "29/03/2020",
        "csv": "csv/covid-19-resultado-sospechosos-indre-2020-03-29.csv",
        "txt": "txt/covid-19-resultado-sospechosos-indre-2020-03-29.txt"
    },
    {
        "pdf": "covid-19-resultado-sospechosos-indre-2020-03-30.pdf",
        "date": "30/03/2020",
        "csv": "csv/covid-19-resultado-sospechosos-indre-2020-03-30.csv",
        "txt": "txt/covid-19-resultado-sospechosos-indre-2020-03-30.txt"
    },
    {
        "pdf": "covid-19-resultado-sospechosos-indre-2020-03-31.pdf",
        "date": "31/03/2020",
        "csv": "csv/covid-19-resultado-sospechosos-indre-2020-03-31.csv",
        "txt": "txt/covid-19-resultado-sospechosos-indre-2020-03-31.txt"
    },
    {
        "pdf": "covid-19-resultado-sospechosos-indre-2020-04-01.pdf",
        "date": "01/04/2020",
        "csv": "csv/covid-19-resultado-sospechosos-indre-2020-04-01.csv",
        "txt": "txt/covid-19-resultado-sospechosos-indre-2020-04-01.txt"
    },
    {
        "pdf": "covid-19-resultado-sospechosos-indre-2020-04-02.pdf",
        "date": "02/04/2020",
        "csv": "csv/covid-19-resultado-sospechosos-indre-2020-04-02.csv",
        "txt": "txt/covid-19-resultado-sospechosos-indre-2020-04-02.txt"
    }

  ]
}
# COVID-19 casos en México

